<?xml version="1.0" encoding="utf-8"?>
<xs:ProjectContainer xs:count="1" xmlns:xs="https://github.com/xShadowArmy/digital-commissioning-tool/tree/main/DigitalCommissioningTool/Output/Resources/" xmlns:xsi="http://www.w3.org/2001/XMLSchema-instance" xsi:schemaLocation="https://github.com/xShadowArmy/digital-commissioning-tool/tree/main/DigitalCommissioningTool/Output/Resources/ ProjectContainerSchema.xsd">
    <xs:Container xs:slotCount="20" xs:id="1">
        <xs:Transform>
            <xs:Position xs:x="4.636045" xs:y="0" xs:z="4.91227">
            </xs:Position>
            <xs:Rotation xs:x="0" xs:y="2.075432E-19" xs:z="0">
            </xs:Rotation>
            <xs:Scale xs:x="1" xs:y="1" xs:z="1">
            </xs:Scale>
        </xs:Transform>
        <xs:Items xs:count="20">
            <xs:Item xs:itemName="null">
            </xs:Item>
            <xs:Item xs:itemName="null">
            </xs:Item>
            <xs:Item xs:itemName="null">
            </xs:Item>
            <xs:Item xs:itemName="null">
            </xs:Item>
            <xs:Item xs:itemName="null">
            </xs:Item>
            <xs:Item xs:itemName="null">
            </xs:Item>
            <xs:Item xs:itemName="null">
            </xs:Item>
            <xs:Item xs:itemName="null">
            </xs:Item>
            <xs:Item xs:itemName="null">
            </xs:Item>
            <xs:Item xs:itemName="null">
            </xs:Item>
            <xs:Item xs:itemName="null">
            </xs:Item>
            <xs:Item xs:itemName="null">
            </xs:Item>
            <xs:Item xs:itemName="null">
            </xs:Item>
            <xs:Item xs:itemName="null">
            </xs:Item>
            <xs:Item xs:itemName="null">
            </xs:Item>
            <xs:Item xs:itemName="null">
            </xs:Item>
            <xs:Item xs:itemName="null">
            </xs:Item>
            <xs:Item xs:itemName="null">
            </xs:Item>
            <xs:Item xs:itemName="null">
            </xs:Item>
            <xs:Item xs:itemName="null">
            </xs:Item>
        </xs:Items>
    </xs:Container>
</xs:ProjectContainer>